{
  "$schema": "http://json-schema.org/draft-07/schema#",
  "$id": "battle.schema.json",
  "title": "Battle Atlas track data",
  "type": "object",
  "required": [
    "name",
    "startTime",
    "endTime",
    "units"
  ],
  "additionalProperties": false,
  "properties": {
    "name": {
      "type": "string",
      "minLength": 1
    },
    "startTime": {
      "type": "number",
      "minimum": 0
    },
    "endTime": {
      "type": "number",
      "exclusiveMinimum": 0
    },
    "units": {
      "type": "array",
      "minItems": 1,
      "items": {
        "type": "object",
        "required": [
          "id",
          "name",
          "side",
          "frontage_m",
          "depth_m",
          "keyframes"
        ],
        "additionalProperties": false,
        "properties": {
          "id": {
            "type": "string",
            "minLength": 1
          },
          "name": {
            "type": "string",
            "minLength": 1
          },
          "side": {
            "enum": [
              "union",
              "confederate"
            ]
          },
          "frontage_m": {
            "type": "number",
            "exclusiveMinimum": 0
          },
          "depth_m": {
            "type": "number",
            "exclusiveMinimum": 0
          },
          "keyframes": {
            "type": "array",
            "minItems": 1,
            "items": {
              "type": "object",
              "required": [
                "t",
                "x",
                "z",
                "facing",
                "formation",
                "strength"
              ],
              "additionalProperties": false,
              "properties": {
                "t": {
                  "type": "number",
                  "minimum": 0
                },
                "x": {
                  "type": "number"
                },
                "z": {
                  "type": "number"
                },
                "facing": {
                  "type": "number"
                },
                "formation": {
                  "enum": [
                    "column",
                    "line",
                    "skirmish",
                    "scattered",
                    "routed"
                  ]
                },
                "strength": {
                  "type": "number",
                  "minimum": 0
                },
                "confidence": {
                  "enum": [
                    "documented",
                    "inferred",
                    "unknown"
                  ]
                },
                "citation": {
                  "type": "string"
                }
              },
              "if": {
                "properties": {
                  "confidence": {
                    "const": "documented"
                  }
                },
                "required": [
                  "confidence"
                ]
              },
              "then": {
                "required": [
                  "citation"
                ],
                "properties": {
                  "citation": {
                    "type": "string",
                    "minLength": 1
                  }
                }
              }
            }
          }
        }
      }
    }
  }
}